{
  "$schema": "https://json-schema.org/draft/2020-12/schema",
  "title": "VALP Task State",
  "type": "object",
  "required": ["schema_version", "task_id", "profile", "status", "selected_agents"],
  "properties": {
    "schema_version": {
      "enum": ["valp-visible-loop-state.v1", "valp-visible-loop-state.v2"]
    },
    "task_id": {"type": "string"},
    "profile": {"type": "string"},
    "loop_layer": {"type": "string"},
    "status": {
      "type": "string",
      "description": "Includes suspended while a runtime pauses coordinator model turns."
    },
    "revision": {"type": "integer", "minimum": 0},
    "risk": {"type": "object"},
    "selected_agents": {
      "type": "array",
      "items": {"type": "string"}
    },
    "role_assignments": {
      "type": "object",
      "additionalProperties": {"type": "string", "minLength": 1}
    },
    "assignment_authority": {"const": "leader_declared"},
    "assignment_declaration": {
      "type": "object",
      "additionalProperties": false,
      "required": ["status", "ref", "leader_agent", "selected_by", "selection_ref"],
      "properties": {
        "status": {"const": "recorded"},
        "ref": {"const": "assignment-declaration.json"},
        "leader_agent": {"type": "string", "minLength": 1},
        "selected_by": {"const": "user"},
        "selection_ref": {"type": "string", "minLength": 1}
      }
    },
    "assignment_validation": {
      "type": "object",
      "additionalProperties": false,
      "required": ["status", "ref"],
      "properties": {
        "status": {"enum": ["pass", "blocked"]},
        "ref": {"const": "assignment-validation.json"}
      }
    },
    "model_role_gate": {
      "type": "object",
      "required": ["enforced", "status", "blocked_roles", "fallback_modes", "reason"],
      "properties": {
        "enforced": {"type": "boolean"},
        "status": {"enum": ["pass", "blocked"]},
        "blocked_roles": {"type": "array", "items": {"enum": ["implementer", "reviewer"]}},
        "fallback_modes": {"type": "array", "items": {"enum": ["discovery", "prototype", "manual"]}},
        "reason": {"type": "string", "minLength": 1}
      },
      "additionalProperties": false
    },
    "submission_dependencies": {
      "type": "object",
      "required": ["status", "ref"],
      "properties": {
        "status": {"const": "recorded"},
        "ref": {"const": "submission-dependencies.json"}
      },
      "additionalProperties": false
    },
    "delegation_policy": {
      "type": "object",
      "required": ["status", "ref"],
      "properties": {
        "status": {"const": "recorded"},
        "ref": {"const": "delegation-policy.json"}
      },
      "additionalProperties": false
    },
    "delegation_violation": {"type": "object"},
    "agent_sessions": {"$ref": "#/$defs/agentSessionsMarker"},
    "capabilities_needed": {
      "type": "array",
      "items": {"type": "string"}
    },
    "capabilities_missing": {
      "type": "array",
      "items": {"type": "string"}
    },
    "runtime_adapter": {"type": "object"},
    "local_overlay": {"type": "object"},
    "runtime_task_state_mapping": {"type": "object"},
    "provider_matrix": {"type": "object"},
    "squad_routing": {"type": "object"},
    "context_policies": {"type": "object"},
    "automation_policy": {"type": "object"},
    "context_pack": {"type": "object"},
    "dispatch_payload_budgets": {
      "type": "object",
      "additionalProperties": {"$ref": "#/$defs/dispatchPayloadBudget"}
    },
    "iteration_budget": {
      "type": "object",
      "required": ["status", "ref"],
      "properties": {
        "status": {"const": "recorded"},
        "ref": {"const": "iteration-budget.json"}
      },
      "additionalProperties": false
    },
    "suspension": {"type": "object"},
    "skill_recommendations": {"type": "object"},
    "visible_attention": {"type": "object"},
    "routing_confidence": {"type": "object"},
    "routing_feedback": {"type": "object"},
    "learning_feedback": {"type": "object"},
    "gates": {"type": "object"},
    "approval_required": {"type": "array"},
    "updated_at": {"type": "string"}
  },
  "allOf": [
    {
      "if": {
        "properties": {"schema_version": {"const": "valp-visible-loop-state.v2"}},
        "required": ["schema_version"]
      },
      "then": {
        "required": ["revision"],
        "properties": {
          "status": {
            "enum": [
              "new",
              "published",
              "scanning_capabilities",
              "scanning_context",
              "loading_local_overlay",
              "selecting_runtime_adapter",
              "classifying_task",
              "selecting_profile",
              "decomposing_tasks",
              "recommending_skills",
              "building_provider_matrix",
              "scoring_routes",
              "routing_capabilities",
              "routing_squad",
              "dispatching",
              "suspended",
              "planned",
              "locked",
              "executing",
              "verifying",
              "reviewing",
              "resolving_agent_recommendations",
              "fixing",
              "approval_required",
              "recording",
              "done",
              "blocked",
              "failed",
              "cancelled"
            ]
          },
          "suspension": {"$ref": "urn:valp:schema:deterministic-suspension:v1"}
        }
      },
      "else": {
        "properties": {
          "suspension": {"$ref": "#/$defs/legacySuspension"}
        }
      }
    }
  ],
  "$defs": {
    "agentSessionsMarker": {
      "type": "object",
      "required": ["status", "ref", "receipts_ref"],
      "properties": {
        "status": {"const": "ready"},
        "ref": {"const": "agent-sessions.json"},
        "receipts_ref": {"const": "agent-session-receipts.jsonl"}
      },
      "additionalProperties": false
    },
    "legacySuspension": {
      "type": "object",
      "required": [
        "status",
        "entered_at",
        "deadline_at",
        "waiting_for_agents",
        "receipt_count_at_entry",
        "allowed_resume_events"
      ],
      "properties": {
        "status": {"enum": ["waiting", "resumed"]},
        "entered_at": {"type": "string"},
        "deadline_at": {"type": "string"},
        "waiting_for_agents": {
          "type": "array",
          "minItems": 1,
          "items": {"type": "string"}
        },
        "receipt_count_at_entry": {"type": "integer", "minimum": 0},
        "allowed_resume_events": {
          "type": "array",
          "items": {
            "enum": ["receipt", "timeout", "runtime_failure", "cancellation", "user_input"]
          }
        },
        "resume_event": {
          "enum": ["receipt", "timeout", "runtime_failure", "cancellation", "user_input"]
        },
        "resumed_at": {"type": "string"},
        "resume_ref": {"type": "string"}
      },
      "additionalProperties": false
    },
    "dispatchPayloadBudget": {
      "type": "object",
      "required": ["role", "max_chars", "max_reference_tokens", "token_estimator"],
      "properties": {
        "role": {"enum": ["coordinator", "implementer", "reviewer", "prototype", "researcher", "other"]},
        "max_chars": {"type": "integer", "minimum": 1},
        "max_reference_tokens": {"type": "integer", "minimum": 1},
        "token_estimator": {"const": "ceil(chars/4)"},
        "actual_chars": {"type": "integer", "minimum": 1},
        "actual_reference_tokens": {"type": "integer", "minimum": 1},
        "dispatch_ref": {"type": "string"},
        "skill_slice_ref": {"type": ["string", "null"]}
      },
      "additionalProperties": false
    }
  }
}
